{
  "schema_version": "v1",
  "id": "V2-028-provider-live-opencode",
  "kind": "provider-preflight",
  "created_at": "2026-08-28T01:15:00Z",
  "correlation_id": "v2-028-provider-live-multi",
  "task_id": "V2-028",
  "notes": "Owner-authenticated OpenCode CLI live verification on this machine. The ledger is new and immutable; thresholds are fail-closed runaway stops under the standing flat-rate subscription authorization.",
  "provider": {"name": "opencode", "version": "1.18.18", "executable_path": "/home/takushi/.opencode/bin/opencode"},
  "limits": {"max_invocations": 4, "max_total_cost_usd": 10.0, "worst_case_reservation_usd": 1.0, "currency": "USD", "window": "total", "ledger_path": "/home/takushi/.local/state/agentic-loop/v2/V2-028-provider-live-opencode-cost.json", "enforced_by": "internal/runner.SupervisedInvocationRunner and internal/runner.CostLedger", "fail_closed": true},
  "environment": {"base_names": ["HOME", "PATH"], "granted_names": []},
  "rollback": {"trigger": "the ledger reaches a runaway threshold or an invocation is anomalous", "argv": ["cat", "/home/takushi/.local/state/agentic-loop/v2/V2-028-provider-live-opencode-cost.json"], "completion_conditions": ["stop further OpenCode invocations", "preserve the ledger for inspection", "issue a new approved record rather than editing limits"]},
  "verification": [{"name": "provider-cli-version", "argv": ["/home/takushi/.opencode/bin/opencode", "--version"], "expected": "1.18.18", "read_only": true}],
  "approval": {"approver": "takushi.yokoyama@sansan.com", "approved_at": "2026-08-24T23:22:47Z", "approval_reference": "ev-v2-055-standing-authorization", "scope": "The owner authorises contracted flat-rate Provider subscriptions on the owner's machine; these limits are runaway-detection stops.", "subject_path": ".agents/v2/packets/provider-standing-authorization.json", "subject_digest": "c69a1026f80e8fcd7f6dc05eb5b27c4434c90da43e44cfc0ff6030d62c75f113"}
}
