{"schema_version":"v1","id":"pp-example-0.1.0","kind":"provider-preflight","created_at":"2026-08-24T10:00:00Z","correlation_id":"c-fixture-001","task_id":"V2-047","provider":{"name":"claude","version":"2.1.241","executable_path":"/usr/local/bin/claude"},"limits":{"max_invocations":16,"max_total_cost_usd":10.00,"worst_case_reservation_usd":1.00,"currency":"USD","window":"total","ledger_path":"/var/lib/agentic-loop/provider-ledger.json","enforced_by":"internal/contracts.CheckProviderPreflightLedger","fail_closed":true},"environment":{"base_names":["HOME","PATH","LANG"],"granted_names":[]},"rollback":{"trigger":"provider invocation exceeds max_invocations or max_total_cost_usd","argv":["true"],"completion_conditions":["no further provider invocations occur"]},"verification":[{"name":"provider-cli-version","argv":["claude","--version"],"expected":"2.1.241","read_only":true}],"approval":{"approver":"owner@example.com","approved_at":"2026-08-24T09:00:00Z","approval_reference":"demo-ref","scope":"V2-047 provider preflight fixture","subject_path":".agents/v2/packets/V2-047-work-order.json","subject_digest":"bc6663d17ef6d3fdde5767b4dbd9da8f287384080838a900daa698bb7e6e7bc9"}}
