{
 "schema_version": "v1",
 "id": "V2-075-provider-live-claude-rebind",
 "kind": "provider-preflight",
 "created_at": "2026-08-25T04:15:00Z",
 "correlation_id": "v2-075-live-rebind",
 "task_id": "V2-075",
 "notes": "Re-observation record for V2-075, which re-binds the representative Provider's live record to a freshness claim a gate can judge by measurement (docs/operations/v2-task-dag.md section 4, G6b). It amends nothing: the bytes of V2-017-provider-live-claude.json and of V2-063-provider-live-claude-refresh.json stay unchanged, and it does not reuse either ledger. V2-063's ledger stands at 11 of 12 invocations, so borrowing it would leave a single invocation of headroom for a nine-subtest exercise; this record therefore carries its own limits.ledger_path and its accounting starts from an empty ledger. The exercise run under it is exactly the one the earlier records covered (TestProviderLiveVerticalSlice: I1, I2, I3, I4, I5_I6, I7, I8, caseB and ledger_snapshot, nine subtests), not widened. Thresholds below are runaway-detection stops, never billing ceilings, and are held equal to V2-063's 12 and 8.00 USD because that exercise fitted inside them with one invocation to spare.",
 "provider": {
  "name": "claude",
  "version": "2.1.241",
  "executable_path": "/home/takushi/.local/bin/claude"
 },
 "limits": {
  "max_invocations": 12,
  "max_total_cost_usd": 8.0,
  "worst_case_reservation_usd": 1.0,
  "currency": "USD",
  "window": "total",
  "ledger_path": "/home/takushi/.local/state/agentic-loop/v2/V2-075-provider-live-claude-rebind-cost.json",
  "enforced_by": "internal/runner.SupervisedInvocationRunner and internal/runner.CostLedger",
  "fail_closed": true
 },
 "environment": {
  "base_names": [
   "HOME",
   "PATH"
  ],
  "granted_names": []
 },
 "rollback": {
  "trigger": "the ledger reaches max_invocations or max_total_cost_usd (runaway-detection stop), or a single settled invocation exceeds the 2.00 USD anomaly threshold and the ledger's halted flag is set",
  "argv": [
   "cat",
   "/home/takushi/.local/state/agentic-loop/v2/V2-075-provider-live-claude-rebind-cost.json"
  ],
  "completion_conditions": [
   "no further claude invocations are made for this task without a new, freshly-approved provider-preflight record",
   "the ledger's halted flag, once set, is cleared only by the owner issuing a new approved record, never by editing this record or the ledger file in place",
   "reaching max_invocations or max_total_cost_usd stops the exercise for inspection and is reported as neither a success nor a failure; the limits in this record are never raised and this ledger is never re-initialised to reset the count"
  ]
 },
 "verification": [
  {
   "name": "provider-cli-version",
   "argv": [
    "/home/takushi/.local/bin/claude",
    "--version"
   ],
   "expected": "2.1.241",
   "read_only": true
  }
 ],
 "approval": {
  "approver": "takushi.yokoyama@sansan.com",
  "approved_at": "2026-08-24T23:22:47Z",
  "approval_reference": "owner instruction recorded in the coordinating session of 2026-08-25, transcribed by the coordinator; see ev-v2-055-standing-authorization",
  "scope": "The owner authorises the Loop to invoke the contracted flat-rate Provider subscriptions on the owner's own machines with no per-invocation approval and no count or monetary ceiling, for the duration of the v2 work. Preflight limits stay in force only as runaway-detection thresholds; reaching one is a stop for inspection, never a success. Transcribed by the coordinator under the owner's instruction; ev-v2-055-standing-authorization holds the verbatim instruction and the limits of this record's machine check.",
  "subject_path": ".agents/v2/packets/provider-standing-authorization.json",
  "subject_digest": "c69a1026f80e8fcd7f6dc05eb5b27c4434c90da43e44cfc0ff6030d62c75f113"
 }
}
